en,ru
There are endless things you can learn if you watch.,"Можно узнать бесконечно много, если наблюдать."
But geopolitics teaches that you should ignore what people say and watch what they do.,"Но геополитика учит, что нужно игнорировать слова и наблюдать за поступками людей."
Wordpres also comes with built-in image and multimedia uploading support.,"Кроме того, Wordpress имеет встроенную поддержку загрузки картинок и мультимедиа на сайт."
"In my experience, the vast majority just try to get away with not making a schedule at all.","Мой опыт показывает, что подавляющее большинство пытается вообще избежать составления плана."
Any system where management writes a schedule and hands it off to programmers is doomed to fail.,"Любая система, где начальство пишет план и вручает его программистам, обречена на неудачу."
So the developer enters 30 under Curr Est and 20 under elapsed.,Так что разработчик вводит 30 под Тек Оцн и 20 под Прошло.
An idiotic move that backfires in a splendidly karmic way.,Идиотский шаг который блестяще отзовется на [вашем] кармическом пути.
"India is the home not only of vegetarian cooking, but also of the science of healthful living.","Индия - родина не только вегетарианской кухни, но и науки о здоровом образе жизни - Аюр-веды."
Euroscuola will prepare* the required standard documents:,Euroscuola подготавливает* необходимые стандартные документы:
"...Some time later picture ""The Old Men Gathering Together"" was found in a warehouse of Oakland.","Позже картина ""Сходятся старцы"" была обнаружена на одном из складов калифорнийского города Оклэнда."
In the absence of explicit consent respondents' personal identity shall be protected.,При отсутствии прямого согласия респондента его анонимность не должна нарушаться.
Degradation of harmful metabolic products and necrotic tissue is accelerated.,Вобэнзим ускоряет лизис токсических продуктов обмена веществ и некротизированных тканей.
They can be avoided by administration of the enzyme preparation in divided doses.,"Эти ощущения можно предотвратить, если разделить дневную дозу на большее количество небольших доз."
How to stop AV Antivirus Suite processes:,Как остановить Windows Antispyware 2009 процессы:
All members of the same security zone share similar value to the organization.,Все члены одной зоны безопасности имеют схожую ценность для организации.
Rooms at the Sercotel Spa Porta Maris & Suites del Mar have views of the Costa Blanca.,Номера отеля Sercotel Spa Porta Maris & Suites del Mar располагают видом на побережье Коста-Бланка.
Why is Beilin so afraid of Israel's victory?,Почему же Бейлин так боится победы Израиля?
It was not just a president change at the enterprise where 100% of the shares belongs to the state.,"Это была не просто смена руководителя предприятия, где сто процентов акций принадлежит государству."
Yesterday the Japanese Government also launched an attack against Malaya.,Вчера японское правительство также санкционировало нападение на Малазию.
"It is only when Viswasa is there, Dharma is born.","Только когда есть вера, рождается дхарма."
Such worry will only worsen the situation.,Такое беспокойство только ухудшит ситуацию.
War in this context does not imply merely killing one another by shooting arrows or with missiles.,В этом контексте война не означает просто убийства друг друга с помощью стрел или ракет.
The world is unable to recognise the true nature of such a divine leader.,Мир не способен осознать истинную природу такого божественного руководителя.
The younger brother Subrahmanya immediately plunged into action.,Младший брат Субраманья немедленно бросился выполнять задание.
"When parents refuse, they think that the parents are angry.","Когда родители отказывают, то они думают, что те рассержены."
Administration was of a military-police character.,Управление носило жесткий военно-полицейский характер.
"Felt boots, clothes and coldsteal of Chechen production was especially in great demand.","Так, большим спросом пользовались бурки, сукно и холодное оружие чеченского производства."
A habit can never command important movements.,Привычка никогда не может управлять важными поступками.
Certain other numbers related to various mathematical functions could also be used.,"Также можно воспользоваться и другими числами, связанными с разными математическими функциями."
Kenya has begun realizing some of the gains of universal free primary education (FPE).,Кения приступила к реализации некоторых преимуществ всеобщего бесплатного начального образования (БНО).
Judicial Reforms are predicated upon a new constitution and constitutional amendments.,Основой для судебных реформ являются новая Конституция и конституционные поправки.
"This ensures a good suntan, but requires appropriate protection.","Ровный глубокий загар тут гарантирован, но необходима и соответствующая защита."
"If you are to soar above, there must not be this baggage.","Если вы взлетаете вверх, вы не должны нести с собой багаж."
"Fortunately, local authorities in the area are already doing just that.","К счастью, местные власти в регионе именно этим сейчас и занимаются."
The Constitution of Georgia guarantees trade union activity.,Конституция Грузии гарантирует деятельность профсоюзов.
He also visited Geneva and had a meeting with the ILO Director General.,Помимо этого он посетил Женеву и встретился с Генеральным директором МОТ.
"Nowadays, Armenian wines, cognacs and beers are constant winners at international competitions.","Сегодня армянские вина, коньяк и пиво - неизменные победители международных конкурсов."
Science is being held back by private interests and industry.,Наука тормозится частными интересами в промышленности.
Several different views are expressed by the posters.,Несколько различных точек зрения выражены постерами.
The only argument it takes is an integer value of which one you want to switch to.,"Единственный аргумент - номер терминала, куда вы хотите переключиться."
"Fact: Like people, cats gain weight from eating too much, not exercising enough or both.","Факт: Точно так же, как и люди, если коты мало двигаются и много кушают, они полнеют."
The precious object allowed the man to restore his old house.,Драгоценность позволила человеку восстановить его старый дом.
(E) the median number of days taken by the agency to process different types of requests;,"(Д) среднее количество дней, которое потребовалось учреждению для обработки различных видов запросов;"
"Indeed, the country has run a trade deficit since 2005, with no path back to balance in sight.","Вообще, в стране наблюдается внешнеторговый дефицит с 2005 г., которому не видно конца."
The benefits of such an opening are clear.,Выгоды подобного открытия очевидны.
Visit the exhibition free of charge for its entire duration;,бесплатное посещение выставки в течение всех дней ее работы
But the decision will be driven by our own data.,Но решение будет основываться на наших собственных данных.
Homologous artificial fertilization can be carried out by two different methods:,Гомологичное искуственное оплодотворение может осуществляться двумя различными путями:
<A true and proper right to a child would be contrary to the child's dignity and nature.,Истинное и подлинное право иметь ребенка противорчило бы природе и достоинству самого ребенка.
To each of these two themes it is necessary here to give some further consideration.,Каждой из этих двух тем надлежит дать здесь некоторое дальнейшее развитие.
"In Turkey, Indonesia, and Malaysia, mass education has reached every city, town, and village.","В Турции, Индонезии, Малайзии всеобщее образование достигло отдаленных деревень, не говоря уже о городах."
"I must concede, however, that the analogy with the Protestant Reformation is imperfect.","Быть может, и в самом деле выбранная мною аналогия с протестантской Реформацией не является исчерпывающей."
"- guided tours, hunting and fishing (70-100 km around Vilnius) can be arranged","- По желанию гостей: организация экскурсий, охоты и рыбалки (в радиусе 70-100 км от Вильнюса)"
We are referring here to those cases in which environment plays the predominant role.),"Мы обращаемся здесь к тем случаям, в которых окружающая среда играет преобладающую роль."
We have already mentiond the use of drugs in this connection.,Мы уже имеем опыт использование лекарств в этой связи.
There are physical limitations on the density with which matter can store and process information.,"Существуют физические ограничения на плотность, с которой материя может хранить и обрабатывать информацию."
"For a more comprehensive discussion, the reader may consult Phillips & Singer (1997).",Для более глубокого рассмотрения вопроса читатель может обратиться к Phillips & Singer (1996).
They also achieved approximately insect-level intelligence.,Они и достигали примерно уровня интеллекта насекомых.
35. What do you mean you needed that directory?,"35. Что значит ""мне был нужен этот каталог""?"
We understood from the start that we would have to fight for it everyday.,"Мы понимали с самого начала, что нам придется бороться за нее каждый день."
The failure of imagination extends across the entire political spectrum.,Отсутствие воображения простирается по всему политическому спектру.
It's true he did you good service to-day; but you need not hurry for all that.,"Правда, он сослужил тебе сегодня службу; но ты все-таки не спеши."
"Of course, there are no fascists in our Kremlin.","Нет-нет, у нас, в Кремле, ни в коем случае сидят не фашисты."
"Indeed, what can a bird born in a cage tell you about the sky?","Собственно, что может рассказать о небе рожденная в клетке птичка?"
She has no job and no money as well as Victor.,"Ни работы, ни денег, как у нее, так и у Виктора нет."
"Out in the tunnels again, Drizzt felt his rage beginning to build.","Снова оказавшись в туннелях, Дзирт ощутил, как в нем начинает закипать ярость."
"Drizzt noticed then that the cart had little wheels along its sides as well, aiding in its passage.","Он заметил, что с обеих сторон тележки есть небольшие колесики, помогающие ее продвижению."
The finance dept is one of the best things to look at.,Финансовый отдел является одним из лучших преимуществ.
The agreement will see E.ON Ruhrgas AG take part in this cooperation.,"Речь идет о подключении к этому сотрудничеству компании ""Э.ОН Рургаз АГ""."
"We discussed in detail the issues of infrastructure, railways infrastructure.","Мы очень подробно говорили об области инфраструктуры, железнодорожной инфраструктуры."
"Would Russia like to take part in this format, and what expectations would it have?","Хотела бы Россия войти в этот формат, и что бы Россия ожидала от этого?"
Know how to define and target your market.,Важно суметь определить и нацелиться на свой рынок.
He was at home 1.2 km away from center of explosion.,Он был дома на расстоянии в 1.2 км от эпицентра.
We must assist the process of building viable state structures in Bosnia and Herzegovina.,Мы должны содействовать созданию жизнеспособных государственных структур в Боснии и Герцеговине.
It requires a political dialogue that addresses all parties involved in the conflict.,"Для его решения необходим политический диалог, обращаясь ко всем сторонам, вовлеченным в конфликт."
Click the Switch to compact mode button near the bottom-right corner of the Player.,Нажмите кнопку Переключиться в компактный режим в правом нижнем углу проигрывателя.
"Most of those individuals said they had served in the Israeli military, which is compulsory there.","Большинство из задержанных говорят, что они служили в израильской армии; служба там обязательна, надо заметить."
"""It is the most challenging film I've ever made,"" Cameron said.","""Это мой самый трудный фильм из всех"" сказал Камерон."
TOKIO HOTEL REFUTES RUMOURS ABOUT PREVIOUS TRIP HERE,Tokio Hotel опровергают слухи об их предыдущей поездке сюда
"The keys are responsive and easy to type on, allowing long hours of comfortable typing.","Клавиши ощутимы в нажатии и легки для печати, позволяя с удобством печатать целыми часами."
How many more chickens have to cross the road before you believe it?,"Сколько еще куриц должно перейти улицу, чтобы вы поверили"
7. JOHN GALLIANO graduated from London's St. Martins College of Art & Design in 1983.,7. . JOHN GALLIANO Окончил Колледж London's St. Martins College of Art & Design в 1983.
"There were not many plants on the left bank, so the tent was the only escape from the sun.",На левом берегу растительности мало и спрятаться от солнца можно только под тентом.
Many extrasensory healers use the latter variant only.,Многие экстрасенсы используют только последний вариант.
"And the truth, as a rule, lies in the middle between two extremes.","Истина, как правило, лежит на середине между крайностями."
Windows should separate the administrative user and the standard user by default.,В Windows надо бы по умолчанию разделить пользователя-администратора и обычного пользователя.
The government is obliged to learn lessons these terrorist attacks.,"Уроки, выводы из терактов правительство обязано сделать."
All visitors to the character's profile will then see the character in that pose.,Все посетители профиля будут видеть вашего персонажа именно в этой позе.
Those who have seen Cave Crawler in action are impressed.,Все кто видел Cave Crawler в действии остались впечатленными.
"Most rooms have a balcony, offering a great panoramic view on the lake.","В большинстве номеров есть балкон, с которого открывается панорамный вид на озеро."
The major task for human beings consists of learning how to think.,"Главная задача человека состоит в том, чтобы научиться думать."
Q.: But back then there also existed a Vedic calendar.,ВОПРОС: Но тогда существовал Ведический календарь.
Let's look at InputFile in more detail and see what's going on.,"Давайте рассмотрим подробнее InputFile и посмотрим, что следует делать дальше."
"The public wants the government to ""perpetuate their dependency role of childhood.","Публика желает, чтобы правители продлевали детство, чтобы люди всегда оставались зависимыми детьми."
Seasonal import duties are also applied to some goods.,К отдельной категории товаров применяются сезонные ввозные пошлины.
BUNTY AUR BABLI falls to an all-time low in the latter part.,BUNTY AUR BABLI непрерывно падает вниз в последней части.
The former right-wing government of Greece lied about the size of the country's budget deficit.,Бывшее правое греческое правительство лгало в отношении реального дефицита бюджета.
Kulinsky said he does not rule out that this tendency will persist.,"Причем Кулинский не исключает, что эта тенденция будет продолжаться."
Tonight everyone here remembers what they went through on this spot a year ago.,"В эту ночь каждый здесь вспоминает то, что испытал на этом месте год назад."
And on Guryanov Street the authorities still need to erect a chapel and a memorial park.,А на улице Гурьянова за властями осталось возвести часовню и аллею памяти.
"Get straight to the point, but always think before you speak.","Говорите по существу и всегда думайте перед тем, как говорить."
"Near the PTU I saw buses with people sitting on board, covered in blankets.","Вблизи указанного ПТУ увидел автобусы, в которых сидели люди, укрытые одеялами."
The woman [Sasha] is helping me facilitate this connection.,Женщина [Саша] помогает мне устроить это соединение.
My forefathers are indigenous to that system.,Мои предки были обитателями этой системы.
The moral force of the attacking French army was exhausted.,"Нравственная сила французской, атакующей армии была истощена."
The nectarous feeling in this country is the feeling of love towards one's mother.,Самым сладостным чувством в этой стране является чувство любви к своей матери.
One important point: in bhajans is everyone should join in singing.,Необходимо сделать одно важное замечание: в бхаджанах должны участвовать все.
"If, for example, any edges are coming loose, they can be re-secured.","Если, к примеру, отошли какие-либо края, их можно повторно закрепить."
"Please keep in mind that Jesus called this resurrection the ""last day.""","Пожалуйста, помните, что Иисус назвал это воскресение мертвых ""последним днем""."
Both statements are talking about the same group of people-the faithful ones.,Оба заявления говорят об одной и той же группе людей - преданных верующих.
"Of course, Rome did not appreciate this interpretation.","Конечно, Рим не принимал данную интерпретацию."
Half a million pamphlets were spread in local newspapers.,Было распространено более миллиона брошюр через местные газеты.
"Under thick black brows, his eyes were deeply set and the pale gray of woodsmoke.",Под густыми черными бровями сидели глубоко запрятанные глаза светло-серого цвета древесного пепла.
He was halfway through the doughnuts when an NBC News bulletin interrupted the celebrity chatter.,"Он уже наполовину съел свои булочки, когда праздную болтовню прервал выпуск новостей ""Эн-Би-Си""."
Secondly ariseth a similar objection derived from considerations of Energy.,"Во-вторых, возникает похожее препятствие, вытекающее из соображений Энергии."
Large-scale drug trafficking is also punished with the death sentence.,Наркобизнес в крупных масштабах также влечет за собой высшую меру наказания.
In some provinces you will have to pay a small monthly fee for this insurance.,В некоторых из них вам придется платить небольшой ежемесячный взнос за мед. страховку.
Some of these dictates and injunctions were given in Makkah and some in Madeenah.,Некоторые из этих законов и установлений ниспосылались в Мекке и некоторые в Медине.
1) Alcoholic drinks shall remain Halaal (Lawful and permissible) until six more years pass.,1) Алкогольные напитки должны оставаться Халяль (Законными и допустимыми) пока не пройдет шесть лет.
"Perhaps you'd like to do a nice sketch of that ox making itself at home in my morning-room?""","Может, пожелаете сделать чудесный эскиз этого вола, устроившегося как дома в моей комнате?"
"Addressing the seamen, the President said:",В своем обращении к морякам президент сказала:
Latvian films have been screened in more than ten countries this year.,В этом году латышские фильмы были показаны более чем в десяти странах мира
Kronbergs was born in 1946 and currently resides in Sweden.,Кронбергс родился в 1946 году и в настоящее время живет в Швеции.
Visit to Georgia by Foreign Affairs Minister Artis Pabriks,Визит министра иностранных дел Латвии Артиса Пабрикса в Грузию
