en,ru
"While carpet reduces impact, the downside is it grabs your shoes and can twist your ankle or knee.","Хотя ковер снижает нагрузку, он будет цепляться за вашу обувь, что может привести к вывиху голени или колена."
"Begin each day thus in fellowship with God, and God will be all in all to you.","Начинайте каждый день с общения с Богом, и тогда Бог будет все во всем для вас."
This is good for all the participants and especially for the winners.,"Это хорошо для всех участников, а особенно для победителей."
It means that they are all the same quality.,"То, что все они одинакового качества."
October 28th National Holiday - Independent Czechoslovak State Proclamation Day (1918),28 октября Национальный праздник - День возникновения независимого чехословацкого государства (1918)
Boredom - is another key to the problems of behavior.,Скука - еще один ключ к проблемам в поведении.
"Now, deep into his second incarnation of Tabula Rasa, we try to get to know his game as well.","Сейчас, углубившись в его второе воплощение - игру Tabula Rasa, мы сделаем попытку узнать о ней больше."
We may also share such information with third parties acting on our behalf.,"Мы также можем передавать такую информацию третьим сторонам, действующим от нашего имени."
Just as long as the owner of the cafe does not hear him.,"Но говорит он это так, чтобы его не услышал владелец кафе."
In fact the total power of the world's 283 research reactors is little over 3000 MW.,Сейчас общая мощность всех 283 исследовательских реакторов в мире составляет немногим больше 3000 МВт.
I've heard a few tales of the strange creatures that wander your lands.,"Я слышал несколько баек о странных созданиях, что встречаются в ваших землях."
The connections depend on the output protocol in use.,Соединения зависят от используемого протокола выхода.
Ordinary manufacturing costs associated with complete cycle of production and sales of goods.,"Типичные производственные издержки, связанные с полным циклом освоения, изготовления и реализации продукции."
Eighth step: Align all actions with the dominant deity.,Восьмой шаг: Все свои поступки приравняйте к исполнению Божьей воли.
Other dietary changes we made at that time included avoidance of food colorings and corn.,"Другие изменения в питании, которые мы сделали в то время, включали исключение пищевых красителей и пшеницы."
"His speech became slightly more fluid, he used some new phrases, and he seemed more socially aware.","Его речь стала немного более плавной, он стал использовать немного больше фраз и он стал казаться более общительным."
"Temperature control, water feed, drainage","Контроль температуры, подвод воды, канализации"
"On the Insert tab, in the Links group, click Bookmark.",На вкладке Вставка в группе Ссылки выберите команду Закладка.
"In an average reformist temple, how many people believe that God exists?",Сколько прихожан типичного реформистского храма верит в существование Бога?
"Our son Peter was most entranced by the device, and became quite a pro at surfing the net.","Наш сын Питер был больше всех очарован устройством, и стал весьма неплохо серфить в сети."
"To this end, I have decided to publish the top ten signs that your son is a hacker.","С этой целью я решил опубликовать десять самых важных признаков того, что ваш сын хакер."
"In its initial theoretical guise, this entity was called an infomediary.",В исходном теоретическом виде это понятие называется infomediary (инфопосредник).
"There might even be blood, e.g. if somebody cuts himself shaving.","Может попасться и кровь, если кто-то порезался при бритье."
In case of a positive test result they are excluded from working there.,При положительном результате больным работать на кухне нельзя.
Safer sex means: Anal and vaginal intercourse only with condom.,Безопасный секс значит: анальный и вагинальный секс только с презервативом.
"All have private bathrooms, some featuring hydromassage showers with steam bath functions.","Во всех номерах есть ванные комнаты, в некоторых из которых имеется гидромассажный душ с функциями паровой бани."
Its power is not limited to renaming functions only.,Возможности SR не ограничиваются только переименованием.
Make sure that the water is either not too hot nor too cold.,"Следите за тем, чтобы вода не была ни слишком горячей, ни слишком холодной."
More money than ever is being poured into electric-car technology.,В наши дни в технологии электромобилей вливается очень много денег.
Les Roches is one of the top three hospitality schools in the world.,Les Roches- один из трех лучших ВУЗов в мире сфере гостеприимства.
"As more of these spaces open, the rest of our team will be sure to jump on board.","Я уверен, что со временем остальные члены команды тоже переберутся к коворкинг офисы."
"""Herzog Rabenstrange is waiting to join us all for dinner.",- Герцог Рабенштранге приглашает нас всех на обед.
"The work has brought numerous comments and opinions, as well as specific criticisms.","Выражено много мнений и отзывов, как и конкретные критические замечания."
Atoms and molecules are stable forms of organization of the substantial form of display of matter.,Атомы и молекулы представляют стабильные формы организации вещественной формы проявления материи.
The assumption about the tectonic plates and the role of the tectonic forces is unnecessary.,"Ненужным оказывается представление о межконтинентальных плитах, как и о роли текстонических сил."
The wreck of a former merchant ship lies at a depth of twenty meters.,Остов купеческого судна до сих пор лежит на глубине 20 метров.
Both in terms of peripheral drivers and simply in platform changes.,"Как в области драйверов для периферии, так и в области изменения самой платформы."
A wireless microphone is affixed to his left ear.,Беспроводной микрофон прикреплен к его левому уху.
"(The essay, he tells me, placed his bid for tenure in jeopardy.)","(Он рассказал мне, что это эссе чуть не стоило ему заявки на собственность)."
He doesn't want to turn them off or offend.,Он не хочет отвернуть их от фильма или оскорбить.
This will also be the first real opportunity to see where the competition stands.,"Это будет первая реальная возможность увидеть, как мы смотримся на фоне конкурентов."
The fury and sheer frantic energy of Norther's delivery is simply stunning.,"Ярость и абсолютно безумная энергия подачи ""Norther"" является просто ошеломляющей."
"After Divadelni namesti turn left, cross the river and you are in front of Trziste street.",За Дивадельним намести поверните налево через реку по улице вверх и по правой стороне увидите Замковые Лазне.
In Balchik is one private airport for small planes,Балчик имеет частный аэропорт для небольших самолетов .
He put the gun back into the bureau drawer and shut the drawer.,Он опустил пистолет обратно в ящик комода и задвинул ящик.
And a little of that sadness returned each year to him.,И частичка той грусти возвращалась к нему каждый год.
"Astana enjoys good relations with the United States, the European Union, Russia and China.","У Астаны сложились хорошие отношения с Соединенными Штатами, Евросоюзом, Россией и Китаем."
"The oceans are huge and ""gentlemen of fortune"" will always find a place for their activities.","Океан велик, и люди, жаждущие легкой наживы, к сожалению, всегда найдут место для своей деятельности."
"Girls and boys, men and women, children and old people.","Девушки и юноши, мужчины и женщины, дети и старики."
Medallion on the doors and doors also were made by in accordance with models of Fedor Tolstoy.,"Медальоны на дверях Храма, как и сами двери, исполнялись по моделям графа Федора Толстого."
It was tremendous communication of artistic people.,Это было колоссальное общение творческих людей.
The bunk was under him and three of the four walls of the room enclosed him like a cave.,"Позади него стояла койка, а три из четырех стен окружали его, словно пещера."
"Lavender, blue, yellow and my favorite pink- little faces bobbing in the biter wind.","Сиреневые, голубые, желтые и мои любимые розовые, как маленькие головки, кивающие на сильном ветру."
"Suddenly I slowed, stopped and stared at the lawn.","Вдруг я притормозила, остановилась и уставилась на лужайку."
Similar knowledge hubs have been established in Eastern Europe and West Africa.,Аналогичные центры знания были основаны в Восточной Европе и Западной Африке.
I remember particularly the fate of one family.,Особенно памятна мне судьба одной семьи.
"I got an offer to take the helm, and gladly accepted it.","Мне предложили ее возглавить, и я с удовольствием согласился."
Making a ceramic sculpture higher than 1 m is very difficult.,А это очень сложно: сделать керамическую скульптуру размером больше метра.
The role of the lawyer begins from the moment the child is taken to the police station.,Роль адвоката начинается с момента приведения ребенка в полицейский участок.
3. Phytates tightly bind to metal ions and make them unavailable for absorption.,3. Фитаты крепко связываются с ионами металла и делают их недоступными для всасывания.
Little did she know that it was all part of the evil sword's plans.,"Она подозревала, что это является частью плана Меча Зла."
OMB and the agencies resolve many issues themselves.,Многие вопросы АБУ и агентства решают самостоятельно.
Any documents that use the automatic font color are affected if you change this setting.,"Изменение этого параметра повлияет на все документы, в которых используется автоматический цвет шрифта."
It plans to invest $300 million in the project within four years.,В течение четырех лет в этот проект планируется вложить около 300 млн. долл.
I recently had my personal best view of the Clown.,Недавно я получил лучший в моей практике вид Клоуна.
Yuri is a cryobiologist at the University of Kharkov in Ukraine.,Юрий - криобиолог в Харьковском Университете на Украине.
The most expensive energy resource up until September 2008 was oil.,Самым дорогостоящим энергоресурсом вплоть до сентября 2008 года была нефть.
Nobody needs to question Matt Mullenweg's authority with PHP.,Никто не станет подвергать сомнению авторитет Мэтта касательно PHP.
Continuous dialogue as construed by the ICRC must be founded on a relationship of trust.,С позиции МККК продолжающийся диалог должен быть основан на доверительных отношениях.
"In concrete terms, this can include the following, depending on the circumstances:","Иными словами, в зависимости от обстоятельств это может включать в себя следующие виды помощи:"
It was believed that eye make-up could ward off evil spirits and improve the sight.,"Считалось, что макияж глаз может отвратить злых духов и улучшить зрение."
"We are the witnesses of changes in the whole country, in a separate region, and at one enterprise.","На наших глазах перемены происходят в масштабах и страны, и отдельно взятого региона, и одного предприятия."
"Of course, marriage was a serious choice.","Конечно, жениться - уже серьезный выбор."
Of course I would like to be happy more often then to be sad.,"Конечно, хотелось бы просто чаще радоваться, реже огорчаться."
"In the Navigation Pane, select the object that you want to export the data from.","В области навигации выделите объект, из которого необходимо экспортировать данные."
"Therefore, we produce reliable, high quality and easy to use equipment.","Поэтому мы производим надежное, качественное и простое в использовании оборудование."
"Location: Central Asia, bordering the Caspian Sea, between Iran and Kazakhstan","Местоположение: Центральная Азия, побережье Каспийского моря между Ираном и Казахстаном."
Normal oscillations will occur within the range of +100 and -100.,Нормальные осцилляции происходят в области от +100 до -100.
"Ergot had a mysterious, contradictory reputation.",У спорыньи была таинственная и противоречивая репутация.
"In theory, the new investors' rights laws would protect businessmen and investors in Russia.","Теоретически, законы о правах инвесторов защитили бы бизнесменов и инвесторов в России."
"Its target bas never been the Jew, as a person, but racist Zionism. and undisguised aggression.","Ее мишенью никогда не были евреи как личности, но расистский сионизм и его неприкрытая агрессия."
"All along, the Palestinian dreamt of return.",Все без исключения палестинцы мечтали вернуться.
To him we send our salutations and greetings.,Ему мы шлем наши приветствия и почтение.
President Nursultan Nazarbayev started his working tour over Karaganda region on Friday.,Вчера началась рабочая поездка Президента Нурсултана Назарбаева по Карагандинской области.
"The event became the central in the chain of holiday events, devoted to the day of miner.","Это событие стало одним из центральных в череде праздничных мероприятий, посвященных Дню шахтера."
He says he will kill you with a knife or poison.,"Он говорит, что прирежет вас или отравит."
No container exists that will last as long as the radioactivity of its contents.,"Ни один контейнер не может быть столь же долговечен, как радиоактивность его содержимого."
"Simply select the game interface GameJackal Pro, or create keyboard shortcuts for faster access.","Просто выберите нужную игру в интерфейсе Game Jackal Pro, или создайте клавишную комбинацию для более быстрого доступа."
"Briefly: Free Ukrainian, Russian, English, and French languages.","Кратко: Владею украинским, русским, английским, французским языками."
After that I had the possibility to go to Lvov.,После чего получил возможность поехать во Львов.
Leave the detailed description of your Keyboard Spectator problem in the form below.,Оставьте подробное описание вашей проблемы с TrojanDownloader.VB.zg в нижеуказанной форме.
A nail was found embedded in a sandstone block from the Mesozoic Era.,"А в блоке песчаника с мезозоя нашли гвоздь, и подобных находок множество."
Standard anti-virus software can do nothing against malicious programs like Microgaming/Casino.,"Обычное антивирусное ПО бессильно против вредоносных таких программ, как Jurassic Park III."
As a result it shaved a fraction of a centimetre off all its cutlery to cut weight.,"В результате авиакомпания решила сократить длину всех столовых приборов, чтобы сократить их вес."
Some of the creatures between Jedoga Shadowseeker and Herald Volazj have been removed.,Некоторое количество треш мобов между Джедогой и Глашатаем Волажем было убрано.
"As the artists themselves have admitted, they have stopped only to record a new album.","По признанию артистов, они останавливались только для того, чтобы сделать запись нового альбома."
"Support facilities will open in South-East Asia, Latin America, and Central and Southern Africa.","Планируется открытие сервисных центров в Юго-Восточной Азии, в Латинской Америке, а также в центральной и южной Африке."
This leads us to the ontological question: what can exist in reality?,Это приводит нас к онтологическому вопросу: что может существовать на самом деле?
"""You had a child once, whom you loved and lost.""","- Когда-то у вас была дочь, которую вы любили и потеряли."
The idea to patterning the colors is to make the Adsense look like it is part of the web pages.,"Идея рисунка цвета заключается в том, чтобы Adsense выглядеть это часть веб-страниц."
"Mr. Bush did use tough language, demanding that Russia stop bombing.","Буш использовал жесткую риторику, требуя, чтобы Россия прекратила бомбардировки."
"So, substantially larger than we even thought we would go after initially.","То есть, размера намного большего, чем мы изначально планировали."
Progress on the promises will be reviewed in June 2006.,Продвижение в обещаниях будет пересмотрено в июне 2006 году.
"Write the words up on the board, regardless of whether they are correctly associated or not.","Напишите эти слова на доске, невзирая правильно ли они ассоциируются или нет."
It was a great advertisement for Ricola cough drops.,Какая великолепная реклама для капель от кашля фирмы Рикола!
"The Masai could not be persuaded to work for money, as they had no use for it.","Масаев не возможно было убедить работать за деньги, поскольку они ими не пользовались."
We elected him by a landslide - 98% of the vote.,Мы выбрали его подавляющим большинством голосов - 98%.
Today I have met with the Pope and cardinal Sodano at Vatican.,Сегодня я встретился в Ватикане с Папой Римским и кардиналом Содано.
May be it has started when Kain killed Abel.,"Наверное, он начался тогда, когда Каин убил Авеля."
We are living in one and the same continent and that is why I speak for the uniting Eurasian idea.,"То есть мы живем на одном континенте, и поэтому я выступаю с объединительной идеей евразийства."
Kinyarwanda and French are the official languages.,Официальные языки - киньяруанда и французский.
S. Naigiziki (born 1915) is a prose stylist and the first Rwandan author to write in French.,"Прозаик С. Найгизики (р. 1915) - первый писатель Р., пишущий на французском языке."
Let our support team solve your problem with StatBlaster and repair StatBlaster right now!,Наша служба поддержки готова решить вашу проблему с GLITCH BOT и удалить GLITCH BOT прямо сейчас!
We recommend you to use StatBlaster Removal Tool for safe problem solution.,Мы рекомендуем использовать Утилиту для удаления GLITCH BOT для безопасного решения проблемы.
Will all these obvious enemies of Medvedev just give up?,Неужели все эти явные враги Медведева просто сложат оружие?
What you do when you begin to channel is to increase the number of synaptic pathways.,"Начиная осуществлять ченнелинг, вы увеличиваете число синаптических проводящих путей."
It is almost as if you have reached critical mass and the Hundredth Monkey Theory is activating.,"Он почти похож на то, что вы достигли критической массы и активировали Теорию Сотой Обезьяны."
"Before you answer, ask him what he thinks it is.","Перед тем как ответить, узнайте, что он знает об этом."
"""Look at my hand; whiter than yours, Armand,"" she laughed hysterically.","- Посмотрите на мою руку, она белее Вашей, Арман, - засмеялась она истерично."
In the centre of the smoothly swept back yard was a great bonfire.,В центре гладко выметенного двора полыхал большой костер.
This approach reflects the multimodal nature of the twenty-first century supply chain.,Этот подход отражает многомодальный характер потребительской цепи 21-го столетия.
GSMF: The 16 members are not always active and not always on the same mod.,"GSMF: 16 членов, которые не всегда активны и не всегда работают над одним модом."
