en,ru
"So as soon as the floods receded, the conflicts started again.","Так, вскоре после отступления воды - конфликт начался снова."
"1) supplying food, including Gmeals-on-wheelsg service;","1) организация питания, включая доставку продуктов на дом;"
He deserves Europe's unequivocal gratitude for launching the ECB so successfully.,"Он, несомненно, заслуживает благодарность Европы за успешное начало деятельности ЕЦБ."
It was founded as a military outpost in 1818.,Он возник как военная крепость в 1818 году.
Forty percent move back home with their parents at least once.,Сорок процентов как минимум раз возвращаются к родителям.
What if the brain has its own hierarchy of needs?,"Что, если у мозга есть собственная иерархия потребностей?"
"At a new low price of $199, anyone can easily organize, edit and publish photos like a pro.","Cистематизировать, редактировать и публиковать фотографии на профессиональном уровне теперь может каждый."
It is a halo of light around a star in the Milky Way.,Это гало света вокруг одной из звезд Млечного пути.
"Now I work in the mini-club: walk the boards, communicate with tourists, and develop acting skills.","Теперь я работаю в мини-клубе, выступаю на сцене, общаюсь с туристами, развиваю актерское мастерство."
Samuel Huntington did alert us to the danger.,Сэмюэл Хантингтон предупреждал нас об опасности.
The Free Software movement wants to treat code like a book.,Движение Free Software рассматривает код как книгу.
Initiative group has published appeal to the journalists of Uzbekistan.,Инициативная группа опубликовала обращение к журналистам Узбекистана.
A week ago I happened to be in Sarajevo again - now as a peaceful tourist.,А неделю назад я опять побывал в Сараево уже как мирный турист.
It has made many newspaper readers and TV viewers into fairly successful amateur journalists.,Интернет превратил читателей газет и телезрителей в успешных журналистов-любителей.
All incoming mail must pass customs and any goods sent will be assessed customs duty.,Вся входящая корреспонденция и грузы проходит таможенный контроль и взимается таможенная пошлина.
Muslims in Ukraine have 391 communities and over 150 mosques.,В Украине 391 мусульманских общин и более 150 мечетей.
All apartments are equipped with state-of-the art access control system.,Все квартиры оснащены высокотехнологической системой контроля доступа.
Elephants are the only animals that cannot jump.,"Слоны - единственные животные, которые не могут прыгать."
"By March 1993, Jackson and the boy were together frequently and the sleepovers began.","В марте 1993 года, Майкл и мальчик часто были вместе и даже спали в одной комнате."
"Pellicano began gathering evidence to use in the trial, which was scheduled for March 21, 1994.","Пелликано начал собирать доказательства для судебного разбирательства, которое было назначено на 21 марта 1994."
"He will begin to rescue Israel from the Philistines.""",Именно он начнет спасать Израиль от рук филистимлян.
"Yoga, as they say in India, is a marriage of spirit and matter.","Йога, как говорят в Индии, это брачный союз Духа и Материи."
Magnolias live up to 400 years and are symbols of peace and friendship.,Магнолии живут до 400 лет и являются символом мира и дружбы.
I had just completed my work and was on my way back home.,Я только что закончил свою работу и возвращался домой.
Let us first of all take inventory of all that we have with us.,"Давайте прежде всего сделаем инвентаризацию всего, что мы имеем."
The problem is that we value ourselves in pennies when we are worth a king's ransom.,"Проблема в том, что мы считаем себя мелкой монетой, в то время как мы очень высоко ценимся."
We are a unique hotel located in the centre of Vienna.,Этот уникальный отель расположен в центре Вены.
"On 3 March, the prisoners reportedly suspended their hunger strike.","Согласно сообщениям, 3 марта заключенные приостановили голодовку."
The epic conflict between mankind and the extraterrestrial Mytrans is reaching its peak.,Глобальный конфликт между человечеством и внеземной цивилизацией Mytrans достиг своего пика.
If you successfully finish all three you're awarded even more credit and research points to spend.,"Если вы успешно справитесь со всеми заданиями, то получите еще больше средств и баллов исследования."
"But no matter what team we root for, we like a baseball cap the most when it's worn by a woman.","Но не важно, за какую команду мы болеем, мы любим бейсболку больше, когда она надета на женщине."
"Seeing the dirt, mud, sweat, and occasional road rash is something that stokes our primal side.","Видение земли, грязи, пота и страсти к случайным дорогам, это иногда поддерживает нашу первобытную сторону."
"One imagines the flash of the fairy eye, the stamp of the fairy foot.","Можно представить сверкание феиного глаза, топанье феиной ноги."
"Number, composition, competency and qualification of the teaching staff.","Количество, состав, компетентность и квалификация преподавателей."
"After World War II, the United States did not simply establish itself as the leading world power.",После Второй мировой войны Соединенные Штаты не просто заняли положение ведущей мировой державы.
"Under Windows, the DNS host name defaults to the same name as the NetBIOS computer name.",В Windows DNS-имя узла по умолчанию совпадает с именем компьютера в формате NetBIOS.
"I prefer the latter, because if the program crashes, it's better not to have left the file open.","Я предпочитаю второй способ, так как если программа вылетает, лучше не оставлять файл открытым."
"Alexandr Stavitskii, Director, Centre of Engineering Technologies 'SC Trade', Russia;","Александр Ставицкий, директор Центра инженер-ных технологий ""Си Ес Трейд"", Россия;"
Members of the security forces searched his house but reportedly found nothing incriminating.,"Сотрудники силовых структур обыскали его дом, однако, насколько известно, не нашли ничего противозаконного."
"maximum cost per call session on a given route, calculated per minute ($/min);",максимальная стоимость минуты сеанса связи по направлению ($/мин);
Once the car was lighter and I got into my rhythm I was quite quick.,"Как только болид стал легче, я вошел в свой ритм и ехал весьма быстро."
I believe the Lord will meet each one of us and show us through the Holy City.,"Я верю, что Господь встретит каждого из нас и проведет по Святому Городу."
The very issues which cause the greatest grief now will not even exist in the minds of the saints.,"Те проблемы, которые вызывают сегодня столько печалей, не будут даже и существовать в разуме святых."
We will grow up spiritually and intellectually.,Мы будем возрастать духовно и интеллектуально.
Every square inch of this reconstituted planet will scintillate with the rarest beauty and appeal.,Каждый квадратный сантиметр этой воссозданной земли будет сиять редчайшей красотой и привлекательностью.
"Only in Indonesia, however, have the relations between the two ethnic communities become tense.",Однако отношения между этими этническими группами заметно накалились только в Индонезии.
6. Be engaged at least six months before you get married.,6. Делайте предложение по меньшей мере за шесть месяцев до свадьбы.
Fendt sees potential on these markets for the future.,На этих рынках также есть определенный потенциал развития.
"On bimonthly basis ARIS issues its own information bulletin in Russian, Kyrgyz and English.","АРИС раз в 2 месяца издает собственный бюллетень на русском, кыргызском и английском языках."
Training in water testing and disinfection.,Тренинг по тестированию и обеззараживанию воды.
Investigations were implemented from July to October 2006.,Исследования проводились в период с июля по октябрь 2006 года.
The NGOs continued to provide trainings on various agricultural topics and issues.,Сотрудники НПО продолжали проведение тренингов по разным темам и направлениям сельского хозяйства.
"When it comes to the desire for liberty and justice, there is no clash of civilizations.",Стремление к свободе и справедливости не может привести к столкновению цивилизаций.
"At the age of 94, he still spends the first two hours of his day exercising.",В возрасте 94 лет он все еще посвящает первые два часа своего дня тренировке.
The American recession in 1932 forced him to leave Chicago.,Великая депрессия 1932 года заставляет певца покинуть Чикаго.
"From each account, we can learn something and gain inspiration.",Каждая деталь дает нам возможность узнать что-то новое и получить вдохновение.
Shariputra soon asked Buddha to formulate rules for a code of monastic discipline.,Вскоре Шарипутра попросил Будду сформулировать правила для кодекса монашеской дисциплины.
Failure to do so may be penalized by a fine of up to 50% of the minimum salary.,"Отсутствие такого талона наказывается штрафом, составляющим до 50% минимальной заработной платы."
"Most of them, therefore, were more than content with the change in rulers.",И потому большинство обезьян было очень довольно сменой правителя.
Every good Christian must maintain that the second of these men is more virtuous than the first.,"Всякий добрый христианин обязан считать, что второй из этих людей добродетельнее первого."
We're building a dedicated production studio to support titles like Aion and the Lineage franchise.,"Мы создаем специализированную производственную студию, которая оказывала бы поддержку таким продуктам как Aion и Lineage."
We will have servers physically located both in Europe and North America for launch.,К моменту запуска сервера будут находиться в Европе и Северной Америке.
conventional long form: Republic of Tajikistan,общепринятая полная форма: Республика Таджикистан;
"Mineral resources, varied but limited in amount, include silver, gold, uranium, and tungsten.","Полезные ископаемые разнообразные, но в ограниченном количестве: серебро, золото, уран и вольфрам."
"The one exception is Eastern Asia, where the practice is less common in rural than in urban areas.","Исключение составляет Восточная Азия, где такая практика менее распространена в сельских, нежели в городских районах."
RSS is even poised to change the business world.,С появлением RSS изменится даже мир бизнеса.
Joseph's valiant effort to save him went in vain.,Героические усилия Джозефа спасти друга ни к чему не привели.
This note taking application allows you to organize all of your online research quickly and easily.,"Делая необходимые записи, Вы, таким образом, легко и быстро организуете исследование просторов сети."
His case inflamed the national debate over capital punishment versus rehabilitation.,Его дело породило общенациональные дебаты о соотношении смертной казни и реабилитации.
"Develop the quality of implicit obedience to the wishes of your mother, without a second thought.","Развивайте качество беспрекословного, не требующего раздумий повиновения словам своей матери."
All this will undoubtedly increase social unrest in the country.,Все это неизбежно обострит социальную ситуацию в стране.
Ted Bundy was executed at 7:15 am the day after this conversation was recorded.,Тед Банди был казнен в 7:15 утра на следующий день после этого интервью.
""" Explain yourself further,"" I requested.","""Объясните подробнее"" - попросил я. Он ответил:"
When you sign-up at Carbon Poker you will receive 35% rakeback.,Регистрируясь через нас в руме Carbon Poker Вы получаете 35% рейкбек.
"In judging others, you reflect your lack of self-acceptance.","Судя других, вы тем самым отражаете недостаток в самовосприятии."
"Take time to be silent, to meditate, to quiet the internal dialogue.","- Найдите время для молчания, для успокоения внутреннего диалога."
"Probably the Volterra scene, where I have to step into the light.","Скорее всего это сцена в Вольтере, где я выхожу на солнечный свет."
"It was Wint, whom I knew from my visits to CERN, who introduced me to Eberstark.","Это был Винт, который узнав о моем визите в CERN, познакомил меня с Эберстарком."
Eberstark attributes his current marriage to a combination of astrology and Wim Klein.,Эберстарк приписывает свою последнюю женитьбу комбинации астрологии и Вима Клейна.
"She discouraged me from the very start, saying 'You're far too clever for me.","Она остановила меня в самом начале, сказав 'Вы слишком умный для меня."
"""I don't think anyone would raise this as an issue.","""Я не думаю, что кто-то станет поднимать этот вопрос."
"It calls for prudence from each, and even more from those who exercise the office of authority.","Оно требует осмотрительности от каждого - и особенно от тех, на ком лежит тяжесть власти."
1915 As far as possible citizens should take an active part in public life.,"Граждане должны, насколько это возможно, принимать активное участие в общественной жизни."
However the opposition can only set up a background - not solve problems in Moscow.,"Однако оппозиция может только создать фон, не может решать вопросы в Москве."
Starting from the 1990s he has owned a number of business facilities in the Georgian territory.,Начиная с 1990-х годов он был владельцем ряда коммерческих объектов на грузинской территории.
On his way back he met Cornelius slouching down with his head between his shoulders.,"Поднимаясь на холм, он встретил Корнелиуса, который, втянув голову в плечи, спускался по склону."
"As for neutrality it's an out-of-date model, I think, which is unreal in the 21st century.","Что касается нейтралитета, то, на мой взгляд, это - устаревшая модель, нереальная в XXI веке."
"They deny the Plaintiffs' claims and say they have done nothing wrong, improper, or unlawful.","Ответчики отрицают свою вину и утверждают, что не сделали ничего неправильного, нечестного или незаконного."
The political charges and counter-charges began to fly soon after the murder.,Вскоре после убийства были выдвинуты первые политические обвинения и контробвинения.
Enter there a full path to the program and a command line it requires.,Здесь укажите полный путь к запускаемой программе и необходимую командную строку.
specify login and password for upload success.,логин (login) и пароль (password) для успешной закачки;
This history revolves around four distinct aspects.,История вращается вокруг четырех различных аспектов.
"Evita Grzibovska, External Relations Advisor to the LPS, has been selected to head the new Office.",Руководителем представительства была утверждена советник СЛС по вопросам внешних связей Эвита Гржибовска.
This setup is strongly recommended for high email volume environments.,Этот вариант рекомендуется для организаций с большим объемом электронной почты.
The European March was the attempt of mobilizing potential before the next year.,Европейский Марш был пробой мобилизационного потенциала перед следующим годом.
Below is a screenshot of ADMsnmp guessing a community string.,Ниже представлен скриншот ADMSNMP предположительных community строк.
"It is just down the Grand Trunk Road from the legendary Khyber Pass, the gateway to Afghanistan.","Он стоит на спуске с великой магистральной дороги от легендарного Хайбергского прохода, ворот к Афганистану."
In October 1880 the Company started to build a new factory.,В октябре 1880 началось строительство новой фабрики.
This was subsequently the basis of the business review documentation and Company archives.,Впоследствии эти службы стали основой для службы документации по обзору деловой активности и архивов компании.
In Italy the Societa Italiana Persil SpA was founded in Lomazzo near Como.,В Италии была создана компания Societa Italiana Persil SpA в городе Ломаццо около Комо.
After the war they were all expropriated or placed under public administration.,После войны все компании были экспроприированы или перешли под государственный контроль.
"The Company's Management and Advisory Boards were reorganized, effective as of December 10.","Руководство компании и Консультативные комитеты были реорганизованы, и 10 декабря приступили к работе."
He had been active in the Company for 47 years.,Он активно работал в компании на протяжении 47 лет.
"On July 7, the head of the Company, Dr. Jost Henkel, died suddenly at the age of just 52.","7 июля глава компании, д-р Йост Хенкель, скоропостижно скончался в возрасте 52 лет."
"""About 643,000 people were sentenced to death.",643 000 из них были приговорены к смерти.
"Download movies, TV shows, music videos, and audiobooks from the iTunes Store on your iPhone.","Покупайте фильмы и аудиокниги их из iTunes Store на Вашем iPhone, также можно будет брать напрокат."
"So Batina is hidden, but she's a superhero.","Так что Батина скрыта, но она супергероиня."
Officials have not responded to the charges.,Официальные лица на эти обвинения никак не реагируют.
"When someone else's pain affects you deeply, it can be hard to reach out rather than turn away.","Когда чужая боль слишком сильно воздействует на вас, то может быть сложно не отпрянуть."
The prepared performances will be shown in each member state.,Подготовленные представления будут демонстрироваться в каждой стране ЕС.
"And by this, I mean more than just saying, ""That's how it's done so get over it!"".","И я подразумеваю больше, чем просто ""Это делается так, потому что делается так""."
But you wouldn't expect Globalist agit-prop from a former Jesuit.,Но Вы бы не ожидали агит-поддержку глобализма от бывшего иезуита?
Ukrainians have to provide horse-driven carts to transport their future landlords free of charge.,Украинцы обязаны были бесплатно выделять подводы для перевозки своих будущих помещиков.
Thanks to Kiev for a perfect organization and thanks to hospitable Ukrainians!,Благодарим Киев за безупречную организацию и всех украинцев за гостеприимство и поддержку!
"There was a firm belief, too, that financial markets had changed.","Прочны были также убеждения, что финансовые рынки изменились."
"How much this review is true, we will see at CeBIT 2006.","Насколько данный прогноз был верен, мы увидим на CeBIT 2006."
"New medical facilities, institutes, specialized clinics and centers were built.","Открыты новые медицинские учреждения, институты, специализиро-ванные клиники и центры."
"It explained the nature of their belief, which was rock solid in uncertain times.","Послание объясняло природу их веры, непоколебимой как скала в смутные времена."
14 Tips to Lose Weight & Be Healthier in Time for Summer,"14 советов о том, как сбросить вес и быть здоровым."
