en,ru
"When you're 18 or 19 years old, you have that gang mentality in your band.","Когда тебе 18 или 19 лет, легко перенимать бандитские повадки и переносить их в группу."
Now you have Black Sabbath and Kiss tribute albums.,А сейчас куча триьютов тем же самым BLACK SABBATH и KISS.
The following missing headline answers questions regarding citizen relocation:,"Следующие из отсутствующих заголовков новостей, касаются перемещения граждан:"
"There is no possibility of cheating: It is either good or bad.""","Здесь невозможно сплутовать: либо он хорош, либо плох."""
Kremlin promises punitive measures against the organisation,Кремль обещает принять к этой организации карательные меры.
"In that sense, every country is interesting.",В этом плане интересна каждая страна.
After that they directly began to fulfill the ceremony.,После этого приступали непосредственно к совершению обряда.
She took the boy to the underground world.,Она повела мальчика в подземный мир.
The country was gradually recovering after the default of August 1998.,"Cтрана понемногу, но все же приходила в себя после дефолта в августе 1998 года."
"Thus, the state borders had not only the function to contribute to defining a national identity.",Таким образом государственные границы выполняли не только функцию определения национальной идентичности.
"No, there were no other projects back then, and there are still no others.","Нет, у меня тогда не было никаких других проектов, нет их и сейчас."
Over these years have you worked out a system to deal with them?,"За эти годы ты, наверное, выработал систему поведения с ними?"
"In 1983, I was managing a work group for a large construction organization.",В 1983 году я руководил рабочей группой для крупной строительной организации.
It should also have restrained South Ossetian militias from running amok against Georgian villages.,Она также не должна была позволять силам Южной Осетии нападать на грузинские деревни.
The mantra is that Russia cannot have a veto on Nato membership.,У России не может быть права вето на вступление стран в НАТО.
"When Nato's foreign ministers met last week, France and Germany made that point.",Франция и Германия указали на это на встрече министров иностранных дел НАТО на прошлой неделе.
Which means you will have to turn up your velocity (again using more air) to compensate.,"Это значит, что придется увеличить скорость (опять-таки используя больше газа) чтобы компенсировать это."
"In our attitude, this is one of the greatest shortcomings of the real park business.","По нашему мнению, это один из самых больших недостатков сфере недвижимости страны."
Provision should be made for the presentation of substitute or alternate evidence / documentation.,Должна быть предусмотрена возможность представления субститутных или альтернативных свидетельств или документации.
They precede the development of all faiths.,Они предшествуют появлению всех религий.
The judgments dissolving Ilinden provided sufficient information in this respect.,"В постановлениях о роспуске ассоциации ""Илинден"" содержится достаточно информации в связи с этим."
He was less worried about the future of Europe and felt that Stalin could be trusted.,"Его меньше беспокоило будущее Европы, и он полагал, что Сталину можно было доверять."
Some research suggests 10 percent of women may suffer from HSDD.,"Некоторые исследователи полагают, что гиполибидемией могут страдать 10% женщин."
When we received the forms back I was very optimistic that they were in order.,"Когда мы получили наши формы обратно, я был уверен что все будет в порядке."
"As he motioned towards the door, Walter could only bow his head and retire.","Так как он указал рукой на дверь, Уолтеру оставалось только поклониться и уйти."
It struck the third floor balcony on its way down and sort of ricochetted into the street.,"Падая, она ударилась о балкон на третьем этаже и рикошетом отскочила на улицу."
"'I was wondering,' Sally said, 'what happened to the poor pig?'","- Интересно, - спросила Салли, - что случилось с бедной свиньей?"
"Anything I've ever said, I certainly was feeling at the time.","Все что я говорил, я реально чувствовал в то время."
"""To the east, the Khajiiti are burning everything, and to the west, the High Elves are waging war.","- На востоке каджиты жгут все, что попадается под руку, высокие эльфы разжигают войну."
"Said this, I think I can understand how much my music can mean to some people.","Говоря о ней, я думаю, что могу понять, что моя музыка может значить для некоторых людей."
Most Indo-Fijians are Hindu (75 percent) or Muslim (16 percent).,Большинство индо-фиджийцев является индуистами (75 %) или мусульманами (16 %).
Fear not: Perl provides a comparable operation with the same name.,Спешим обрадовать: в Perl есть почти сравнимая операция с таким же именем.
Information will be issued electronically wherever possible.,"Информация всегда, когда возможно, предоставляется в электронном виде."
In the last few years several constituencies came together to create a new momentum.,"В последние годы несколько влиятельных сил объединились, чтобы придать ей новый импульс."
Protect the device from exposure to direct sunlight and extreme temperatures.,"Защищайте прибор от длительного воздействия прямых солнечных лучей, резких перепадов температур."
Your company will have the opportunity to provide design and performance feedback for the product.,Ваша компания получит возможность оставить свои отзывы и предложения о структуре и работе продукта.
Here's what we just learned from Katerina herself:,"Вот то, что мы только что узнали от самой Катерины:"
IT's response has been to decentralize IT operations.,Ответ IT состоит в децентрализации IT-операций.
The old prince understood from this official report that our army had been defeated.,"Старый князь понял из этого официального известия, что наши были разбиты."
Software designed to harvest addresses must not be used.,не должно использоваться программное обеспечение для сбора адресов.
Specifies the application domain to use for the Loader.load() or Loader.loadBytes() method.,Задает домен приложения для применения с методом Loader.load() или Loader.loadBytes().
We indicated that the only people who could do this work were members of the armed forces.,"Нашей стороной ему было указано, что эту работу могут выполнить только военные."
I saw her far across the clearing .already and racing towards the chapel doors.,"Я увидел, что она уже пересекла поляну и спешит к церковным дверям."
And she would see the blood in streaks on my face and it would scare her even more.,А она увидит полосы крови на моем лице и оттого испугается еще больше.
"Of course, these two need not be exclusive, indeed, nor should they.","Koнечно эти две причины важны, но не единственные, а есть еще и много других."
There are many traditional Bulgarian dishes that have an unmistakable Greek or Turkish influence.,Несомненно на многие из традиционных болгарских блюд оказали влияние греческая и турецкая кухни.
"But now the media are realizing their lies to demoralize the mujahideen,"" Haqqani said.","Но теперь СМИ понимают, что их ложь нужна, чтобы деморализовать моджахедов""."
This of course includes Haqqani and his considerable following.,"В том числе ее будут придерживаться, конечно же, Хаккани и его последователи."
Canonical Scripture is the divinely inspired and therefore normative witness to Christ.,"Каноническое Писание является богодухновенным и, следовательно, нормативным свидетельством о Христе."
"This means that at bottom independent reason now has authority, as opposed to Scriptural teaching.","Это означает, что в итоге авторитетом сейчас пользуется независимый разум, противопоставивший себя учению Писания."
- Joint advertising campaign of the exhibition:,- объединенная рекламная кампания выставки:
"At the mine where the research was conducted, the area of rock bursts threat is established.","На шахте, где проводились исследования, установлена зона угрозы горных ударов."
"""Look what I bought today at Stockmann,"" Chartkov shouted.","""Посмотрите, что я купил сегодня в ""Стокманне"", - сказал Чартков."
"When this place is finished, I want to create a multimedia studio.","Когда здесь все будет закончено, я хочу создать мультимедийную студию."
We cannot bear more suffering in our fellow man.,Мы не можем больше выносить страдание вокруг нас.
It is not a democratic but an aristocratic term!,"Это вовсе не демократический, а аристократический термин!"
The laws of Massachusetts were based on the same premise.,На той же основе базировались законы Массачусетса.
"It is harder to do our own stuff, but that's a lot more interesting","Конечно же, тяжелее всего делать собственный материал, но это намного интереснее."
FJ: What were some instruments you developed?,FJ: Какие инструменты Вы создали сами?
Forced migrants organized a protest action,Вынужденные переселенцы провели акцию протеста
In India there was a fashion of drinking too much milk.,В Индии было принято выпивать слишком много молока.
Even the son of the king who gave me this place has no idea.,"Даже сын раджи, передавший мне это место во владение, не знает, что там."
No motive for arson could be adduced by the company or police and no suspect was arrested.,"Компания и полиция не смогли выявить мотива для поджога, поэтому никто не был арестован."
What is lacking is the strategic vision and determined action of the major political players.,"Чего нам недостает, так это стратегического видения и целенаправленных действий главных политических игроков."
So it was only right that when you ask for this story,"И это правильно, что ты просил меня поведать эту историю."
Christ on the Cross pours out his Blood to set humanity free from the slavery of sin and death.,"Христос на Кресте пролил всю Свою кровь, чтобы освободить человечество от рабства греха и смерти."
"Once all of the gold has detached from the pins, the bath is allowed to settle.","После того, как золото было отделено от контактов, ванне нужно дать время отстояться."
"And in spite of his fear, Ben found that part of him did want a balloon.","И несмотря на свой страх, Бен понял, что какая-то часть его действительно хочет шарик."
The threat of the ALF also makes companies to invest loads of money into security systems.,"Чтобы избежать дальнейших атак, они будут вынуждены вкладывать большие деньги в системы безопасности."
These young people are disillusioned by the sad reality that society gives them.,Печальная реальность современного общества разочаровала этих людей.
"Though you may have submitted more than one code, the system will only see the highest one.","Вы можете активировать более одного кода, но система будет видеть только тот, что имеет более высокий статус."
"8. Why was ""It's a Mystery"" released only in 1997?","- Почему альбом ""It's A Mystery"" был выпущен лишь в 1997 году?"
The proceeds are put into the strike fund.,Доходы поступают в забастовочный фонд.
Our family story of the transition to veganism is the following.,А наша семейная история перехода к веганству (veganism) такова.
"Israel The first conscious starting point was my dear wife-Tanya, the mother of my daughter.","И.М.: Первым осознанным толчком была моя дорогая жена - Таня, мать моей дочки."
Almost no one understands that it is missing.,"Почти никто не понимает, что ее не хватает."
Tatiana I had difficulties when we became vegetarians.,"Татьяна: Для меня были трудности, когда мы стали вегетарианцами."
How popular is vegetarianism in your surrounding in America?,Насколько популярно вегетарианство в вашем окружении в Америке?
"Don't know what can be more delicious than mango-soy milk shake (""lassie"")!","Не знаю, что бывает вкуснее коктейля (""ласси"") из манго с соевым молоком!"
The things found during my arrest proved my story.,"Вещи, найденные у меня, подтверждали эту версию."
"For them, involuntary sterilisation has resulted in negative health effects and even divorce.",Принудительная стерилизация вызвала у них проблемы со здоровьем и даже привела к разводам.
"embankment of the Southern Canal, 946 m long",Банкетная набережная Южного канала длиной 946 м.;
The [img] tag allows you to embed images within your posts.,BB код [img] позволяет вставлять изображения в пределах вашего сообщения.
"Nevertheless, the Patriarch never stepped in.",Однако Патриарх никогда не вмешивался.
"""I see him before holidays, at consecrations of all kinds of buildings, including military ones.","'Я вижу его перед праздниками, на освящении всякого рода сооружений, в том числе и военных."
3) Ramsin Yuseb (The terrorist who threatened to destroy the Twin Towers in 1993) has 11 letters.,"3) В имени Ramsin Yuseb (террорист, в 1993 году запланировавший разрушение Башен Близнецов в Нью-Йорке) 11 букв"
"Be prepared for a tremendous amount of action if you approach the Rush Poker tables, however.","Однако приготовьтесь к невероятному объему игры, если сядете за стол Rush Poker."
"On the international level, the most pressing issue is mitigation of climate change.",На международном уровне самой насущной проблемой является смягчение последствий изменения климата.
"Yes, all countries in Europe allow non-EU residents to expand their business into Europe.","Да, все европейские страны разрешают нерезидентам размещать свой бизнес в Европе."
"Yes, and the amount and frequency depends upon the country in which you form your company.","Сумма и периодичность оплаты зависят от страны Европы, в которой зарегистрирована компания."
17. Expand the scope of employee autonomy.,17. Повысить степень автономности сотрудников.
JavaScript works in the user's web browser rather than on the web server.,"JavaScript работает в браузере пользователя, а не на сервере."
"A man went to visit the husband of his sister, then some time dead.",Один человек поехал в гости к мужу недавно умершей сестры.
Culture is not a frozen set of values and practices.,Культура не есть застывший набор ценностей и обычаев.
"To see this, consider some of the differences Horton emphasises.","Чтобы убедиться в этом, рассмотрим некоторые различия, подчеркиваемые Гортоном."
But the rationality of our beliefs will certainly be considerably increased.,"Рациональность же наших убеждений, безусловно, значительно возрастет."
"We were never the band of concepts, I am sure we won?t change on this record either.","Мы никогда не были концептуальной группой, и я уверен, что мы не изменимся на этой записи."
"The businessman claims that production of the dog food is steady, nothing changes in it.","Бизнесмен утверждает, что производство корма для собак установлено, нечто не меняется."
There perhaps we may live out our brief days as we wish.,"Может быть, там сможем прожить конец наших дней, как сами хотим."
Group interim report for the third quarter of 2009,Промежуточный отчет Концерна 3 квартал 2009
"At one time or another, your child may be beset by fears such as these.",В то или иное время вашего ребенка могут охватывать подобные страхи.
"NOTE When inserted properly, the CD end of the system will reach the end of the system sleeve.","ПРИМЕЧАНИЕ Если установка проведена правильно, конец CD для системы дойдет до конца системной трубки."
The function refused working in all the profiles except for the default one.,"В нашем случае данная функция не работала при всех профилях, кроме установленного по умолчанию."
"They were to be his seed group, his future foremen.","Они были его испытательной группой, будущими мастерами."
Ravana taught a great lesson to the world.,Равана преподает миру великий урок.
"I wouldn't contaminate my toilet with your red, white and blue rag.",Но я бы не украсил и своего туалета этой красно-бело-синей тряпкой.
"Fortunately, over the past few years, momentum has been gathering to achieve this very goal.","К счастью, за последние несколько лет появилось и окрепло стремление идти к этой цели."
"""And come back and find the house in ruins?"" she snarled.","""А потом вернуться и обнаружить дом в руинах?"" - огрызнулась она."
"Dudley, meanwhile, was counting his presents.",Между тем Дадли пересчитывал свои подарки.
They have been taught to handle Russian (Soviet) weapons.,"Они обучены владеть российским (советским), а не американским оружием."
The operating system and all functionality is obtained across the network using the tftp protocol.,Операционная система и весь набор функций загружаются по сети с помощью протокола TFTP.
The fees could be retained by ROSRAO as part of its income or could be passed through to the Fund.,Такие платежи могут удерживаться РОСРАО в качестве части своего дохода или могут быть переданы в Фонд.
From 1999 graduates of PSU are given diplomas of a new state standard.,С 1999 года выпускникам ПГУ выдаются дипломы нового государственного образца.
The center has the function of making international contacts and relations of the university.,Этому центру приданы функции организатора международных связей и контактов университета.
The calculated sunrise time for your location,Время восхода солнца для вашего местоположения
"Regarding institutions, new federal laws have changed the political and electoral systems.",Сейчас в области институтов приняты федеральные законы по изменению политической и избирательной системы.
A law is being drafted to regulate this aspect of Russia's development.,"Создается закон, согласно которому будет регламентироваться эта область развития России."
Life changes rapidly and the changes can be incorporated into the programme.,Жизнь стремительно меняется и изменения в программу могут быть приняты.
The descriptions which follow are drawn from these official sources.,Приводимые ниже описания почерпнуты из этих официальных источников.
How often must I use xylitol for it to be effective?,"Как часто нужно употреблять ксилит, чтобы он был эффективным?"
Four of these once marked the boundaries of ancient Karakorum.,Когда-то четыре таких камня лежали в основании древнего Каракорума.
"Domesticating authority takes many forms, some of which are difficult to recognize.","Одомашнивающая власть принимает множества форм, некоторые из которых тяжело опознать."
There are probably dozens of herbs that can dissolve kidney crystals and stones.,"Вероятно, существуют десятки трав, которые растворяют почечные кристаллы и камни."
Scripture shows us that He whole heartily embraced biblical Judaism.,"Писания показывают нам, что он сердечно принял библейский иудаизм."
Shaul (Paul) had the greatest respect for Torah.,Шауль (Павел) имел большое уважение к Торе.
